Campaign,Ad Group,Keyword,Match Type,Headline 1,Headline 2,Headline 3,Description 1,Description 2,Final URL
Shift-Suite for Care - JP - Search,介護_シフト管理_全般,介護 シフト管理,Broad,介護のシフト管理をAIで自動化,Excelで始める人員配置の最適化,【導入実績300施設】Shift-Suite,AIがケアプランとスキルを基に最適な人員配置を自動作成。管理者の負担を90%削減し、職員の満足度を向上。まずは資料をダウンロード。,https://www.shift-suite-for-care.example.com
Shift-Suite for Care - JP - Search,介護_シフト管理_全般,介護 シフト 自動,Broad,希望休と配置基準を両立,シフト作成、月40時間→5時間に,AIによるシフト自動作成,AIがケアプランとスキルを基に最適な人員配置を自動作成。管理者の負担を90%削減し、職員の満足度を向上。まずは資料をダウンロード。,https://www.shift-suite-for-care.example.com
Shift-Suite for Care - JP - Search,介護_シフト管理_全般,特養 シフト作成,Broad,特養のシフト作成を効率化,人員配置基準をAIがチェック,介護DXならShift-Suite,夜勤や業務負荷の偏りをなくし、職員の不満を解消。データに基づいた公平なシフトで離職率を改善。全国300施設以上での導入実績。,https://www.shift-suite-for-care.example.com
Shift-Suite for Care - JP - Search,介護_人員問題_離職,介護職員 離職率,Broad,職員の離職、シフトが原因？,介護の人員不足をデータで解決,【定着率52%改善】Shift-Suite,夜勤や業務負荷の偏りをなくし、職員の不満を解消。データに基づいた公平なシフトで離職率を改善。全国300施設以上での導入実績。,https://www.shift-suite-for-care.example.com
Shift-Suite for Care - JP - Search,介護_人員問題_離職,介護職員 定着,Broad,公平なシフトで職員の不満解消,AIが離職リスクを早期検知,働きがいのある職場を実現,AIがケアプランとスキルを基に最適な人員配置を自動作成。管理者の負担を90%削減し、職員の満足度を向上。まずは資料をダウンロード。,https://www.shift-suite-for-care.example.com
Shift-Suite for Care - JP - Search,介護_コスト削減,介護 人件費 削減,Broad,残業代・人件費を大幅に削減,Excelで始めるコスト最適化,年間数百万円のコスト削減事例,AIがケアプランとスキルを基に最適な人員配置を自動作成。管理者の負担を90%削減し、職員の満足度を向上。まずは資料をダウンロード。,https://www.shift-suite-for-care.example.com
Shift-Suite for Care - JP - Search,介護_コスト削減,介護 経営改善,Broad,データで実現する介護経営改善,AIで人件費を最適化,【無料診断】人件費シミュレーション,夜勤や業務負荷の偏りをなくし、職員の不満を解消。データに基づいた公平なシフトで離職率を改善。全国300施設以上での導入実績。,https://www.shift-suite-for-care.example.com
